,deezer_id,genres,id,name,popularity,genre
3499,9032,"[grupera, latin, latin pop, regional mexican]",3tJnB0s6c3oXPq1SCCavnd,Marco Antonio Solís,74,latin
3500,1311,"[chanson, french indie pop, french indietronica, french rock]",6IoS9ojtxKCL1tW5VL1buI,Dominique A,46,chanson
3501,84969,"[canadian contemporary country, contemporary country, country, country road, modern country rock]",4aJTB79uwT4sP0Nb8QGWHc,Joe Nichols,60,contemporary country
3502,15690,"[acid jazz, electro swing, ninja, nu jazz, trip hop]",4N9nNkpjGuBlGWnYubQI8t,Belleruche,45,trip hop
3503,495889,"[adoracao, brazilian gospel]",2eYrf1zekGvHGRkl9DZyGR,Renascer Praise,51,adoracao
3504,1520943,"[axe, pagode]",153Lu5Zmx36hPnRpaHV0zq,Os Morenos,43,pagode
3505,379458,"[axe, pagode]",2zUi8eGWcojkvBwCysFOyC,Karametade,44,pagode
3506,58632,"[french hip hop, trap francais]",4NKumVnSozo1F50Wji9ddY,Alpha 5.20,48,french hip hop
3507,1383726,[sleep],14RkTXnwrf6D09TfPWcR5C,Massage Tribe,61,sleep
3508,239,"[alternative hip hop, conscious hip hop, dirty south rap, east coast hip hop, hardcore hip hop, hip hop, neo soul, pop rap, rap, southern hip hop]",78xUyw6FkVZrRAtziFdtdu,The Roots,64,rap
3509,2749,"[classic soul, jazz blues, rhythm and blues, soul]",0WZ7IgzdjPvwFdjDjjuZm7,Esther Phillips,44,soul
3510,720,"[g funk, gangster rap, hyphy, west coast rap]",3z3g65U7mmyyBmmDfsQK9x,Luniz,61,gangster rap
3511,728,"[french pop, operatic pop]",7ocwZINHqO9DZJgFtc1B20,Lara Fabian,56,french pop
3512,2025,"[dance pop, dance rock, europop, mellow gold, new wave pop, permanent wave, pop rock, soft rock]",2BTZIqw0ntH9MvilQ3ewNY,Cyndi Lauper,71,dance pop
3513,13313,"[latin rock, rock en espanol]",4Vo7jk7sjpIFMk14dedex5,Draco Rosa,53,rock en espanol
3514,14512,"[hungarian pop, hungarian rock]",1fMg1feUs2pvsfjs6rkAp3,Magna Cum Laude,33,hungarian pop
3515,4004,"[ccm, christian alternative rock, christian music, christian rock, worship]",6APm8EjxOHSYM5B4i3vT3q,MercyMe,65,christian alternative rock
3516,132,[],2DtidViVelNGRQW2Znq5Mf,Opus Orange,34,
3517,16016,"[brazilian hip hop, forro, mpb, pagode, samba, velha guarda]",3aqtJPuhfwxQ60jG1OAFQt,Bezerra Da Silva,54,mpb
3518,4000,"[anthem worship, ccm, christian alternative rock, christian music, christian rock, world worship, worship]",6eJqAWJdd8JhAN1pQGie4r,Casting Crowns,68,world worship
3519,520,"[boy band, dance pop, pop, post-teen pop]",6Ff53KvcvAj5U7Z1vojB5o,*NSYNC,73,pop
3520,264483,"[brega, jovem guarda]",6JLlNmdxxY4xIsD9Kuq9bZ,Vanusa,29,brega
3521,75156,"[electro latino, latin, latin hip hop, pop, reggaeton, tropical]",1wZtkThiXbVNtj6hee6dz9,Wisin & Yandel,78,pop
3522,17202,"[folk-pop, indie folk, irish rock, irish singer-songwriter, melancholia, neo mellow]",3Caot8EtHX6wLpNF2wRzS0,Glen Hansard,59,folk-pop
3523,16455,"[fado, portuguese pop]",65nZq8l5VZRG4X445F5kmN,Mariza,53,portuguese pop
3524,124,"[bubblegum dance, eurodance, europop, hip house]",0Suv0tRrNrUlRzAy8aXjma,Haddaway,63,europop
3525,448410,"[classic soul, disco, funk, jazz funk, motown, post-disco, quiet storm, soul, urban contemporary]",7aHa6IZwZ13FoC5AXFkCSh,The Jones Girls,42,urban contemporary
3526,65828,"[bubblegum dance, classic schlager, discofox, german pop, german rock, oktoberfest, schlager]",4rvJA6PKInIg35XkH4HESw,Jürgen Drews,51,german pop
3527,8734,"[latin, salsa, tropical]",5Wg6XnPTp0xXxFCjywwR9I,Eddie Santiago,62,latin
3528,13408,"[banda, cumbia, grupera, norteno, ranchera, regional mexican]",16kOCiqZ1auY4sokSeZuKf,Los Bukis,70,regional mexican
3529,11552,[german hip hop],3c96G4d2lUOxhomM2mby5S,Bushido,76,german hip hop
3530,90655,[french hip hop],2uuaoYjn1Pk0Y3NOyMR0KR,Zoxea,39,french hip hop
3531,9157,[chanson],5y65nQvIt9ABZ2Dkv5191h,Diane Tell,35,chanson
3532,753,"[francoton, french hip hop, french pop, rap conscient, trap francais]",2CLtDhw1uJe59E3P56JN6T,Psy 4 De La Rime,46,french hip hop
3533,7914,"[alternative metal, christian alternative rock, christian metal, christian rock, melodic metalcore, nu metal]",6f3a43i1MJZwdjEpV1M0oH,Demon Hunter,55,alternative metal
3534,110459,"[bossa nova, brazilian indie, brazilian psychedelic, brazilian rock, mpb, psychedelic rock, rock gaucho, samba]",5C0gCCG8N5Dh5dZytIgzLX,Os Mutantes,51,mpb
3535,8556,"[contemporary country, country, country road, country rock, outlaw country, traditional country]",6rJqqRce0Kvo2dJUXoHleC,Alabama,64,contemporary country
3536,919,"[alternative rock, dance-punk, garage rock, indie rock, modern rock, rock, scottish rock]",0XNa1vTidXlvJ2gHSsRi4A,Franz Ferdinand,70,rock
3537,16691,"[adoracao, brazilian gospel]",3XFPsySK5XlfmcxJGWcyWn,Pra. Ludmila Ferber,45,adoracao
3538,2655,"[canadian contemporary country, contemporary country, country road, deep talent show, modern country rock]",4oUHIQIBe0LHzYfvXNW4QM,Morgan Wallen,68,contemporary country
3539,71238,[french hip hop],2lAwZifHVNBbwwsiCRprUv,Bouga,34,french hip hop
3540,527,"[album rock, funk metal, glam metal, hard rock, rock]",6w7j5wQ5AI5OQYlcM15s2L,Extreme,65,rock
3541,352242,"[broadway, hollywood, show tunes]",0bvwPCit9Yh0yVdLKGnXRi,Adam Pascal,59,hollywood
3542,1179,"[alternative rock, pop punk, pop rock, post-grunge]",2iEvnFsWxR0Syqu2JNopAd,Smash Mouth,71,pop rock
3543,1515,"[canadian pop, chamber pop, folk-pop, melancholia, piano rock, singer-songwriter]",2PfBzriIMRsCXPDtSy9vg8,Rufus Wainwright,59,folk-pop
3544,3566,"[alternative metal, chicago punk, hardcore punk, nu metal, pop punk, post-grunge, punk, rap rock]",6Wr3hh341P84m3EI8qdn9O,Rise Against,75,post-grunge
3545,5734,"[album rock, classic rock, folk rock, heartland rock, mellow gold, pop rock, rock, singer-songwriter, soft rock, southern rock]",3lPQ2Fk5JOwGWAF3ORFCqH,John Mellencamp,66,rock
3546,12745,"[axe, latin alternative, mpb, samba]",5jvQoouPSDvUEwynz5KPpv,Carlinhos Brown,53,mpb
3547,110555,[jazz funk],3dGTi4MZZo4zXdQaKAS1va,Rotary Connection,31,jazz funk
3548,142973,[],5Do19ow5oRPYYU46jqdkwh,Bruce Channel,45,
3549,1893,"[baile pop, bossa nova, brazilian rock, mpb, samba]",7dnT2FUXhjirperXaH22IJ,Rita Lee,60,mpb
3550,13747,[french rock],1fFluvsu5I7uvuMngQp995,Louis Bertignac,34,french rock
3551,254,"[reggae, reggae fusion]",3QJzdZJYIAcoET1GcfpNGi,Damian Marley,69,reggae
3552,188321,"[hollywood, post-teen pop]",5RZjpmuD14JKXvB8Ry1G1u,Amanda Seyfried,74,post-teen pop
3553,188312,"[hollywood, post-teen pop]",2HB65P72dFRiOKvbLLcil2,Meryl Streep,70,post-teen pop
3554,75628,"[folk-pop, indie folk, indie pop, indie rock, modern rock, stomp and holler]",0aeLcja6hKzb7Uz2ou7ulP,Noah And The Whale,59,modern rock
3555,5,"[afropop, mande pop, world]",3KH7WsR2JZQ94Ik8SyabU6,Amadou & Mariam,51,afropop
3556,213,"[art rock, dance rock, disco, new romantic, new wave, new wave pop, soft rock, synthpop]",2s79xe5F6eUQkjwjww27Fh,ABC,55,soft rock
3557,1214,"[big beat, downtempo, electronic, hip hop, trip hop, turntablism]",5CE2IfdYZEQGIDsfiRm8SI,DJ Shadow,62,hip hop
3558,1155,"[hip pop, uk garage]",42qLC3FgtazA9AvaIoiP62,Ms. Dynamite,53,hip pop
3559,1250,"[dub, electro dub, french reggae, uk dub]",1ZWDySC1tbFgkDexxJAM4C,High Tone,40,french reggae
3560,1579045,[],4we5S2VLjgY9KzIzApL1KI,Ryan Tedder,65,
3561,4011,"[acoustic pop, neo mellow, pop, pop rock]",4phGZZrJZRo4ElhRtViYdl,Jason Mraz,80,pop
3562,4990,"[latin, latin arena pop, latin pop, spanish pop, spanish pop rock, tropical]",5gOJTI4TusSENizxhcG7jB,David Bisbal,75,latin
3563,2832,"[conscious hip hop, latin alternative, latin hip hop]",2gKYxTUOqw9aPt7ljMwSHT,Orishas,60,latin hip hop
3564,985101,"[german hip hop, german indie, german pop, german rock]",0MZ55DwuMQ1B2TXq9lcrE4,Kraftklub,64,german hip hop
3565,471045,"[grime, irish hip hop]",0ukgrNYk51TkMQr0f2Br4Q,Maverick Sabre,61,grime
3566,94276,[freestyle],6V7pNWhlJpD0s0bMdB1PU9,Stevie B,50,freestyle
3567,2201,[],2iIn8H3l2NNBNHFpYKWbfo,The Kingsmen,53,
3568,258570,"[art pop, chamber pop, melancholia, vienna indie]",2mAYpnSe3g2Y22JcZ2ddku,Soap&Skin,50,chamber pop
3569,1032,"[adult standards, brill building pop, bubblegum pop, christmas, folk rock, lounge]",3IZrrNonYELubLPJmqOci2,Nancy Sinatra,63,folk rock
3570,204899,"[bossa nova, forro, mpb, samba]",28IcRPf399RPv4TUiZ7uol,Marina Lima,48,mpb
3571,13832,"[baile pop, bossa nova, brazilian indie, forro, mpb, nova mpb, samba, velha guarda]",1gIa65d5ICT2xVWiUJ3u27,Tom Zé,48,mpb
3572,1593210,"[baile pop, brazilian rock, mpb, nova mpb]",1R9QfzgBmhk1spLg3BiU1f,5 a Seco,56,mpb
3573,340158,"[kizomba, zouk]",1oxDq8JrrBTX5Jnb7ftH1w,Mika Mendes,45,kizomba
3574,210712,[historic piano performance],4dKudxEVOFAAf2QzJdPZjj,Samson François,42,historic piano performance
3575,1255983,"[banda, regional mexican]",7sDRPHDNEOmnPgyfYWUITM,Banda Sinaloense El Recodo De Cruz Lizarraga,44,regional mexican
3576,516830,"[acoustic pop, dance pop, folk-pop, indie anthem-folk, indie folk, neo mellow, neo-singer-songwriter, pop, viral pop]",3w6zswp5THsSKYLICUbDTZ,Gabrielle Aplin,64,pop
3577,12088,[vocal jazz],2bNtosg6E8tvmN6wYxPCfu,Curtis Stigers,48,vocal jazz
3578,649403,[alternative roots rock],2VnNIlyX9iVtx1FYavvm90,Battleme,40,alternative roots rock
3579,392162,[],3ohcHMuUq1717s8AH17hfT,The White Buffalo,61,
3580,470461,"[christian alternative rock, christian rock, hard alternative, post-screamo]",6L5kgEyFIlckHbMdRM2KXQ,Nine Lashes,52,christian alternative rock
3581,1597464,"[baile pop, brazilian indie, mpb, nova mpb]",21LI2q2QDyaNjyfXaWWTOE,Marcelo Jeneci,55,mpb
3582,1007877,"[dance pop, electropop, pop, post-teen pop, r&b, talent show, viral pop]",4m4SfDVbF5wxrwEjDKgi4k,Cher Lloyd,66,pop
3583,1120023,"[bubblegum dance, eurodance, europop, german techno, hip house]",6zkbUEItDv8gNXeO5WkkNX,Maxx,48,europop
3584,1651825,"[electro latino, pop reggaeton]",08Cb5OwPZ7SrS19MNYaHqz,Buxxi,49,pop reggaeton
3585,981,[disco],1oX1l8zC13ovzEoGm2CAsd,The Michael Zager Band,35,disco
3586,372175,"[french indie pop, french rock]",6UWiE4V9p2HK4C74A0CGKB,Skip the Use,43,french rock
3587,1268,"[britpop, chamber pop, folk-pop, melancholia]",244fcyNSuyhbRlMGfMbYrO,Badly Drawn Boy,49,folk-pop
3588,149292,"[classic italian pop, italian pop]",1yq9UuPp5DIb5w6eswGbKV,Adriano Celentano,58,italian pop
3589,331851,"[cumbia, latin, latin jazz, salsa, tropical]",7BFnoFhJjLWcsqmN3Hizqg,Joe Arroyo,62,latin
3590,3147,"[latin, latin hip hop, reggaeton, reggaeton flow, tropical]",5aB4SpKYteOJ8pAleoKkg7,Hector & Tito,57,latin
3591,3151,"[latin, latin hip hop, pop reggaeton, reggaeton, reggaeton flow, tropical]",7npqy7rgdX2D3yfVyWExKo,Angel Y Khriz,62,latin
3592,1199771,[],43RSyeXCIJROqGo8d6H2zI,Kelly Loreen,35,
3593,786,"[french soundtrack, vintage french electronic]",1DptMAbvFajxK4ZObg1OdA,Éric Serra,46,vintage french electronic
3594,1956,[psychedelic trance],6S2tas4z6DyIklBajDqJxI,Infected Mushroom,61,psychedelic trance
3595,10781820,"[dance pop, electropop, hip pop, pop, post-teen pop, r&b, urban contemporary]",5xuNBZoM7z1Vv8IQ6uM0p6,JoJo,67,pop
3596,470349,[canadian rock],6jEiUoyyJNPHzSR0Nib6HX,Walk Off the Earth,64,canadian rock
3597,265455,[],5jJNrnAYqiZYriWYuh17Mt,Somewhere Over The Rainbow,19,
3598,1199471,"[british soundtrack, epicore, scorecore, soundtrack, video game music]",6dU7gPN2BhEPfO5QHLt7es,Lorne Balfe,60,soundtrack
3599,409894,"[acoustic pop, folk-pop, indie folk, indiecoustica, neo mellow, new americana, stomp and holler]",6J7rw7NELJUCThPbAfyLIE,The Civil Wars,65,folk-pop
3600,6717,"[boogaloo, latin, latin jazz, mambo, salsa, tropical]",4vOycwLXdkMMzpZW04VW5m,Tito Nieves,59,latin
3601,824351,"[deep disco house, deep euro house, deep melodic euro house, house, tech house]",2JnkjHtuUjz83gkEx8QMS4,Adana Twins,47,house
3602,4131843,"[baroque ensemble, classical performance, early music, early music ensemble, historically informed performance]",2h9ZEx9DABEGQyZ5oij09G,Le Concert Des Nations,44,classical performance
3603,8455,[],3NcPjvA2rp9FPj1JBAXwOS,Maxence Cyrin,52,
3604,175997,"[big room, dance pop, deep big room, edm, electro house, progressive electro house, progressive house, tropical house]",6hyMWrxGBsOx6sWcVj1DqP,Sebastian Ingrosso,65,dance pop
3605,1640605,[classical piano],0TeMHLkl2Y7C96S0MsvKAP,Håkon Austbø,39,classical piano
3606,5695,"[classical, classical era]",4NJhFmfw43RLBLjQvxDuRS,Wolfgang Amadeus Mozart,76,classical
3607,3016,"[album rock, glam metal, hard rock, metal, power metal, rock, speed metal]",3BVkDHWRvLJEyKdvhLbjsq,W.A.S.P.,59,rock
3608,5176,"[classical, post-romantic era]",1Uff91EOsvd99rtAupatMP,Claude Debussy,70,classical
3609,1900,"[baroque, classical, early music, german baroque, german jazz]",5aIqB5nVVvmFsvSdExz408,Johann Sebastian Bach,78,classical
3610,398752,"[contemporary country, country, country dawn, country road, modern country rock]",75FnCoo4FBxH5K1Rrx0k5A,The Band Perry,61,contemporary country
3611,1642469,"[alternative dance, chillwave, electropop, indie pop, indie poptimism, indie psych-rock, indietronica, metropopolis, modern alternative rock, modern rock, neo-synthpop, shimmer pop, vapor soul]",5WId4o5jdGVhptNU0uqKxu,St. Lucia,60,modern rock
3612,263633,"[afrobeat, classic soul, funk, soul]",2bToe6WyGvADJftreuXh2K,Lee Fields & The Expressions,54,soul
3613,12246,"[dance pop, pop, post-teen pop]",06HL4z0CvFAxyc27GXpf02,Taylor Swift,89,pop
3614,1004566,[],53w2XJb5gOntC0zBRCDmYd,Jayme Dee,37,
3615,242950,"[bossa nova, brazilian hip hop, brazilian indie, brazilian punk, brazilian rock, forro, manguebeat, mpb, rock gaucho, samba]",7HnkRhoGqYLTasI52iJoE7,Chico Science,50,mpb
3616,5611,"[boogaloo, latin jazz, mambo, salsa, tropical]",7x5Slu7yTE5icZjNsc3OzW,Willie Colón,65,tropical
3617,9491,"[classic italian pop, italian pop]",00w9sdZ78mWArooTmiSTld,Umberto Tozzi,54,italian pop
3618,393464,"[alternative metal, nu metal, post-grunge, rap rock]",64g59lHsc4g2jMFokrKDGW,My Darkest Days,60,post-grunge
3619,8804,[italian disco],1Tzu45aHnn0Xz4msfhHRW1,Gazebo,44,italian disco
3620,332319,"[compositional ambient, focus, german soundtrack]",6fTuDQJqqMDrrEXSFmgyJt,Hauschka,55,compositional ambient
3621,13613,"[chamber pop, folk-pop, indie folk, indie pop, modern rock, stomp and holler]",5EM6xJN2QNk0cL7EEm9HR9,Radical Face,59,modern rock
3622,1662526,"[ambient, compositional ambient, dark jazz, drift, drone, fourth world, warm drone]",0GQJRlsTD8irKEDcClYiiA,Deaf Center,48,compositional ambient
3623,80747,[french pop],4X9M41I7WyckA4qjzo17pX,Elisa Tovati,36,french pop
3624,998013,"[dance pop, europop]",0BmLNz4nSLfoWYW1cYsElL,Alexandra Stan,60,dance pop
3625,893313,[electro latino],2ny2IhV61AbrsaWpjvGM7m,José de Rico,51,electro latino
3626,10094,"[dancehall, dub, lovers rock, reggae, roots reggae]",5WcGRaGsl0b9sul7jVdDgc,Don Carlos,50,dancehall
3627,1012947,[],7vy0OevOpPswNjEUxXPhaR,Will Stratton,49,
3628,290,"[dance pop, pop, pop rock]",6tbjWDEIzxoDsBA1FuhfPW,Madonna,78,pop
3629,1169,"[chamber pop, folk-pop, gothenburg indie, indie folk, neo mellow, stomp and holler, swedish indie pop, swedish singer-songwriter]",6xrCU6zdcSTsG2hLrojpmI,José González,69,folk-pop
3630,3519,[classic french pop],7ee9JJuqLBnVjTZ4UXblnu,Philippe Lafontaine,31,classic french pop
3631,816,"[album rock, blues-rock, classic rock, hard rock, mellow gold, rock, southern rock]",4MVyzYMgTwdP7Z49wAZHx0,Lynyrd Skynyrd,74,rock
3632,7524,"[contemporary country, country, country road]",2bA6fzP0lMAQ4kz6CF61w8,Toby Keith,69,contemporary country
3633,2746,"[bubblegum pop, folk rock]",7d7AZ3CQC457bFhK0wHpSO,Scott McKenzie,53,folk rock
3634,292,"[french hip hop, rap conscient, trap francais]",7rz6ZZErn5YFDteXKhyf3g,Disiz La Peste,60,french hip hop
3635,94024,"[boogaloo, latin jazz, mambo, salsa, tropical]",7opp16lU7VM3l2WBdGMYHP,Héctor Lavoe,63,tropical
3636,6075,"[adult standards, brill building pop, christmas, doo-wop, rock-and-roll, rockabilly]",3MFp4cYuYtTZe3d3xkLLbr,Bill Haley & His Comets,56,adult standards
3637,1634131,"[latin, panamanian pop, tropical]",5eYDJJfPXinVZq2mXleOSW,Fito Blanko,51,latin
3638,1581786,"[folk-pop, indie folk, indie pop, metropopolis, modern alternative rock, modern rock, stomp and holler]",4dwdTW1Lfiq0cM8nBAqIIz,Of Monsters and Men,72,modern rock
3639,112170,"[boogaloo, jazz trumpet, latin jazz, mambo]",76KY8JsK3XMQkjDiRZVprS,Pete Rodriguez,46,latin jazz
3640,116337,"[dancehall, reggae fusion, roots reggae]",4RfTXjK9aiiIKDaKUHpL57,Busy Signal,63,dancehall
3641,108493,"[alternative metal, nu metal, post-grunge]",6om12Ev5ppgoMy3OYSoech,Halestorm,67,post-grunge
3642,979,[disco],3Dd6jD1AApgtNoU6SJWR7P,Anita Ward,47,disco
3643,16528,"[brill building pop, classic soul, disco, funk, motown, quiet storm, rhythm and blues, soul, southern soul]",6TKOZZDd5uV5KnyC5G4MUt,Smokey Robinson & The Miracles,61,soul
3644,152218,"[dance pop, edm, pop rap]",698hF4vcwHwPy8ltmXermq,Far East Movement,67,dance pop
3645,410,"[reggae fusion, ska mexicano, ska punk]",0EdvGhlC1FkGItLOWQzG4J,Sublime,73,reggae fusion
3646,494812,"[latin christian, latin worship]",6vetaGijEBK3wfhtCUWRBS,Lilly Goodman,59,latin worship
3647,67,"[album rock, classic rock, glam rock, hard rock, metal, rock]",07XSN3sPlIlB2L2XNcTwJw,KISS,73,rock
3648,490,"[alternative metal, funk metal, nu metal, pop punk, pop rock, post-grunge, rap rock]",2MqhkhX4npxDZ62ObR5ELO,Hoobastank,67,pop rock
3649,16230,"[brazilian rock, latin alternative, latin rock, mpb, rock gaucho]",7EM9m7HOXxVgP9oEpDDv70,Os Paralamas Do Sucesso,64,mpb
3650,361398,"[indie pop, modern alternative rock, modern rock, neo mellow, pop, pop punk, pop rock, post-teen pop]",0RpddSzUHfncUWNJXKOsjy,Neon Trees,64,pop
3651,16238,"[argentine rock, latin, latin alternative, latin pop, latin rock, rock en espanol, rock nacional]",5VQCk9RiLwri99OgOT34kq,Vilma Palma e Vampiros,62,latin
3652,5024,"[cuban rumba, latin, latin jazz, mambo, salsa, tropical]",2weA6hhVqTIN2gSn9PUB9U,Celia Cruz,64,latin
3653,583,"[alternative dance, filter house, indie poptimism, indietronica, new rave, nu disco]",2mV8aJphiSHYJf43DxL7Gt,Chromeo,62,indietronica
3654,468743,"[adoracao, brazilian gospel, louvor, world worship]",6AyvSIi2EyLOaMJCc6J5fZ,Leonardo Gonçalves,59,adoracao
3655,400,"[alternative hip hop, battle rap, dirty south rap, gangster rap, hardcore hip hop, hip hop, pop rap, rap, southern hip hop]",2Jwr7hGoSNK3S3QBxh3T0z,Freeway,52,rap
3656,2468,"[album rock, classic rock, rock, roots rock, southern rock]",3IYUhFvPQItj6xySrBmZkd,Creedence Clearwater Revival,78,rock
3657,8912,[],03aEAJbldwonrzcgblugnf,Bizarre Blitz,39,
3658,12459,"[bossa nova, choro, forro, mpb, pagode, samba, velha guarda]",0t2xdTxRXnffsmpMamH8Ls,Paulinho Da Viola,53,mpb
3659,170008,"[alternative dance, art pop, dance-punk, electropop, escape room, folk-pop, indie pop, indietronica, new rave]",6Jrxnp0JgqmeUX1veU591p,Santigold,65,folk-pop
3660,1660,"[acid jazz, downtempo, ninja, nu jazz, trip hop, turntablism]",1hwAhXzyuEUjug2pyNVSvg,DJ Cam,43,trip hop
3661,68288,"[jawaiian, kaneka, polynesian pop]",7oEWmZ9dKlAVxTgmjUbYr4,J Boog,59,jawaiian
3662,12141,"[banda, grupera, latin pop, norteno, regional mexican]",7FsRH5bw8iWpSbMX1G7xf1,Joan Sebastian,75,latin pop
3663,6478,[classic rock],7f8LNBVXN0h35veHrpxQFL,Norman Greenbaum,61,classic rock
3664,474,"[bubblegum dance, dance pop, eurodance, europop, hip house, new wave pop, pop rock, swedish pop]",5ksRONqssB7BR161NTtJAm,Ace of Base,65,dance pop
3665,447550,[],5tYBNolgC0xwAennb0L6dt,Carrapicho,37,
3666,683,"[alternative rock, funk rock, garage rock, hardcore punk, punk, rock, ska punk, skate punk]",30U8fYtiNpeA5KH6H87QUV,Dead Kennedys,57,rock
3667,3506,"[dirty south rap, gangster rap, hardcore hip hop, hip hop, pop rap, rap, southern hip hop, trap music]",0P8YNJXX7QeQ8iZIUCXJgi,The Diplomats,48,rap
3668,4194,"[brill building pop, bubblegum pop, folk rock, psychedelic rock]",2VIoWte1HPDbZ2WqHd2La7,The Turtles,61,folk rock
3669,91948,[french pop],1ELgiI6P1y4zEkVElVjCbC,Matt Houston,43,french pop
3670,803748,"[dance pop, pop, post-teen pop, viral pop]",4M0DLz8te9Q1lNIXBBwvfG,Karmin,55,pop
3671,74311,"[latin, latin alternative, latin rock, mexican rock, rock en espanol]",09xj0S68Y1OU1vHMCZAIvz,Café Tacvba,72,latin
3672,3460,"[folk-pop, icelandic indie, icelandic pop, trip hop]",08j69Ndyx1P7RLO3Janb5P,Emilíana Torrini,53,folk-pop
3673,1239,"[alternative dance, alternative rock, brooklyn indie, chamber pop, dance-punk, freak folk, garage rock, indie folk, indie pop, indie rock, indietronica, modern rock, neo-psychedelic, new rave, noise pop, stomp and holler]",3HJIB8sYPyxrFGuwvKXSLR,TV On The Radio,61,modern rock
3674,4063,"[alternative hip hop, conscious hip hop, east coast hip hop, gangster rap, hardcore hip hop, hip hop, pop rap, rap, southern hip hop]",0Mz5XE0kb1GBnbLQm2VbcO,Mos Def,66,rap
3675,909,"[disco, funk, motown, p funk, soul]",5SMVzTJyKFJ7TUb46DglcH,Parliament,58,soul
3676,8281,[chanson],5MuxhSyL8BYuuWHeKmWSEx,Isabelle Adjani,31,chanson
3677,5252,"[neo soul, r&b, urban contemporary]",7Gf3LSwa5hh8Cjo60WhVjC,India.Arie,60,r&b
3678,1012,"[afropop, belly dance, classic arab pop, rai]",2URqJkDiySO0FRiAUq75FV,Rachid Taha,49,afropop
3679,817,"[album rock, art rock, british invasion, classic rock, folk rock, hard rock, mellow gold, protopunk, psychedelic rock, rock, roots rock]",67ea9eGLXYMsO2eYQRui3w,The Who,72,rock
3680,2659,[],1kJXCyS43NnwlscWJFxjCK,DJ Drama & Young Jeezy,21,
3681,49602692,"[album rock, blues-rock, classic rock, hard rock, metal, rock, southern rock]",2AM4ilv6UzW0uMRuqKtDgN,ZZ Top,70,rock
3682,4630,[native american hip hop],0VZTVVWxTYnuC90abMZ74Y,Gathering of Nations Pow Wow,22,native american hip hop
3683,6144,"[classical, classical era, early romantic era]",2wOqMjp9TyABvtHdOSOTUS,Ludwig van Beethoven,73,classical
3684,614,"[adult standards, christmas, easy listening]",6ZjFtWeHP9XN7FeKSUe80S,Bing Crosby,73,adult standards
3685,2245,"[scorecore, soundtrack]",1csBgT42N4pPPs1HJhxXIK,Thomas Newman,67,soundtrack
3686,176,"[album rock, classic rock, mellow gold, rock, soft rock]",0WwSkZ7LtFUFjGjMZBMt6T,Dire Straits,76,rock
3687,4617,[hip pop],1IO0GVa1xjkFMXsg66FiE9,Lumidee,51,hip pop
3688,7548660,[],3Bm8cURxUTfVwV7vATST5S,Jonas Kvarnström (feat.Zo),12,
3689,1541,"[big beat, electronic, ninja, nu jazz, trip hop]",6hhA8TKRNryM8FNzqCqdDO,Tricky,54,electronic
3690,1487,"[alternative metal, funk metal, german rock, nu metal, post-grunge, rap rock]",4whxX965DKKqYkXmk33b4E,Guano Apes,52,post-grunge
3691,15362,"[dancehall, jawaiian, reggae fusion, roots reggae]",5Ayl2bJtN5mdCsxZoxs9n1,Collie Buddz,62,dancehall
3692,67334,"[art pop, chamber pop, dark cabaret, melancholia]",4fxp616ALtFWnXfwxnjLzW,Antony and the Johnsons,53,chamber pop
3693,252,"[french hip hop, trap francais]",5nTMNNNwQMoCYgzUXdUaB6,113,48,french hip hop
3694,398,"[boy band, dance pop, europop, pop rock]",3NRFinRTEqUCfaTTZmk8ek,Savage Garden,67,dance pop
3695,4700,"[dance rock, disco, europop, mellow gold, motown, new romantic, new wave, new wave pop, soft rock]",5IDs1CK15HegSAhGEbSYXo,Billy Ocean,62,mellow gold
3696,754,[],55skI5gUCfM4bsRSYzFJKv,Garo,7,
3697,69173,[],4jram38eUCdGS2R23m0zuK,DMC of Run DMC,0,
3698,620,"[adult standards, christmas, classic soul, jazz blues, soul, soul blues, vocal jazz]",0iOVhN3tnSvgDbcg25JoJb,Etta James,68,soul
3699,5229,"[album rock, classic rock, folk rock, heartland rock, mellow gold, pop rock, rock, roots rock, singer-songwriter, soft rock]",2UZMlIwnkgAEDBsw1Rejkn,Tom Petty,70,rock
3700,2110,"[album rock, classic rock, folk rock, hard rock, heartland rock, mellow gold, pop rock, psychedelic rock, rock, roots rock, soft rock]",4tX2TplrkIP4v05BNC903e,Tom Petty and the Heartbreakers,71,rock
3701,3375,"[album rock, art rock, classic rock, dance rock, folk, folk rock, heartland rock, mellow gold, new romantic, new wave, new wave pop, pop rock, rock, soft rock, symphonic rock]",5gxynDEKwNDgxGJmJjZyte,Steve Winwood,63,rock
3702,1910,"[bebop, contemporary post-bop, cool jazz, hard bop, jazz, jazz fusion, jazz trumpet, vocal jazz]",0kbYTNQb4Pb1rPbbaF0pT4,Miles Davis,67,vocal jazz
3703,1626,"[cabaret, chanson]",6NB0vY1HQgkUpCBsm5eAvo,Léo Ferré,43,chanson
3704,3117,"[alternative metal, nu metal, post-grunge, rap metal, rap rock, wrestling]",5S6hjAxgxjsLylsTtMIimO,Saliva,64,post-grunge
3705,5102,"[dance pop, neo soul, new jack swing, quiet storm, r&b, urban contemporary]",6k0IBR0lU42s2GYpNX7kA9,Brian McKnight,64,dance pop
3706,1088,"[chanson, classic french pop, french pop]",6kKVGVM28hXgQDqNPr2CsD,Jean-Luc Lahaye,35,chanson
3707,530,"[alternative metal, finnish metal, groove metal, melodic death metal, metal, power metal, progressive metal, speed metal, viking metal]",1xUhNgw4eJDZfvumIpcz1B,Children Of Bodom,59,alternative metal
3708,756,"[east coast hip hop, electro, gangster rap, hardcore hip hop, hip hop, old school hip hop, rap, turntablism]",3zpKjsMg2gw1St5WcWoUJN,EPMD,55,rap
3709,4678,[],3eFOtlrhUuKPOrO2JlM6AS,Catherine Lara,32,
3710,10849,[],0y1HetKjCPbdu3uYScHlDP,L5 the Crone,20,
3711,9242,"[bebop, big band, contemporary post-bop, cool jazz, hard bop, jazz, jazz fusion, jazz trumpet, latin jazz, soul jazz, stride, swing, vocal jazz]",5RzjqfPS0Bu4bUMkyNNDpn,Dizzy Gillespie,54,vocal jazz
3712,78871,[],0f3nk34zGWkrqKSfwE15Yd,Lady Laistee,22,
3713,77526,"[cabaret, christmas, vocal jazz]",6HB1MchEEMg40EisSJuenZ,Betty Carter,39,christmas
3714,2181,"[boy band, europop, pop punk, post-teen pop]",3Z6IRCo7umuk8K2XQy0ZDj,Busted,59,post-teen pop
3715,3459,"[alternative rock, mellow gold, neo mellow, pop rock, post-grunge, rock]",0jJNGWrpjGIHUdTTJiIYeB,The Wallflowers,61,rock
3716,134,"[bubblegum dance, eurodance, europop, german techno, hip house]",7KBkgunlONG7LPxs93pgpp,Mr. President,56,europop
3717,269,"[dance pop, deep pop r&b, hip hop, hip pop, indie r&b, neo soul, new jack swing, pop, pop rap, r&b, urban contemporary]",05oH07COxkXKIMt6mIPRee,Brandy,67,pop
3718,7961,"[brill building pop, bubblegum pop, folk rock, merseybeat]",3KGQvnOoqUHi3KxKQMZtXr,The Box Tops,51,folk rock
3719,142313,"[zouk, zouk riddim]",3JCfgXnyQBwjAp61EctbQP,Perle Lama,31,zouk riddim
3720,539,"[brill building pop, bubblegum pop, christmas, classic rock, folk, folk rock, mellow gold, psychedelic rock, rock, rock-and-roll, soft rock]",1bs7HoMkSyQwcobCpE9KpN,The Mamas & The Papas,65,rock
